#clustering method	cluster number	cluster color	hex color	gene count	protein name	protein identifier	protein description
MCL	1	Red	#ff0000	25	ATN1	9606.ENSP00000379915	Atrophin-1; Transcriptional corepressor. Recruits NR2E1 to repress transcription. Promotes vascular smooth cell (VSMC) migration and orientation (By similarity). Corepressor of MTG8 transcriptional repression. Has some intrinsic repression activity which is independent of the number of poly-Gln (polyQ) repeats.
MCL	1	Red	#ff0000	25	ATP2C1	9606.ENSP00000421326	Calcium-transporting ATPase type 2C member 1; This magnesium-dependent enzyme catalyzes the hydrolysis of ATP coupled with the transport of the calcium; Belongs to the cation transport ATPase (P-type) (TC 3.A.3) family. Type IIA subfamily.
MCL	1	Red	#ff0000	25	CDK4	9606.ENSP00000257904	Cyclin-dependent kinase 4; Ser/Thr-kinase component of cyclin D-CDK4 (DC) complexes that phosphorylate and inhibit members of the retinoblastoma (RB) protein family including RB1 and regulate the cell-cycle during G(1)/S transition. Phosphorylation of RB1 allows dissociation of the transcription factor E2F from the RB/E2F complexes and the subsequent transcription of E2F target genes which are responsible for the progression through the G(1) phase. Hypophosphorylates RB1 in early G(1) phase. Cyclin D-CDK4 complexes are major integrators of various mitogenenic and antimitogenic signals. [...] 
MCL	1	Red	#ff0000	25	CDK9	9606.ENSP00000362361	Cyclin-dependent kinase 9; Protein kinase involved in the regulation of transcription. Member of the cyclin-dependent kinase pair (CDK9/cyclin-T) complex, also called positive transcription elongation factor b (P-TEFb), which facilitates the transition from abortive to productive elongation by phosphorylating the CTD (C-terminal domain) of the large subunit of RNA polymerase II (RNAP II) POLR2A, SUPT5H and RDBP. This complex is inactive when in the 7SK snRNP complex form. Phosphorylates EP300, MYOD1, RPB1/POLR2A and AR and the negative elongation factors DSIF and NELF. Regulates cytoki [...] 
MCL	1	Red	#ff0000	25	DYRK2	9606.ENSP00000342105	Dual specificity tyrosine-phosphorylation-regulated kinase 2; Serine/threonine-protein kinase involved in the regulation of the mitotic cell cycle, cell proliferation, apoptosis, organization of the cytoskeleton and neurite outgrowth. Functions in part via its role in ubiquitin-dependent proteasomal protein degradation. Functions downstream of ATM and phosphorylates p53/TP53 at 'Ser-46', and thereby contributes to the induction of apoptosis in response to DNA damage. Phosphorylates NFATC1, and thereby inhibits its accumulation in the nucleus and its transcription factor activity. Phosp [...] 
MCL	1	Red	#ff0000	25	ERBB3	9606.ENSP00000267101	Receptor tyrosine-protein kinase erbB-3; Tyrosine-protein kinase that plays an essential role as cell surface receptor for neuregulins. Binds to neuregulin-1 (NRG1) and is activated by it; ligand-binding increases phosphorylation on tyrosine residues and promotes its association with the p85 subunit of phosphatidylinositol 3-kinase. May also be activated by CSPG5. Involved in the regulation of myeloid cell differentiation.
MCL	1	Red	#ff0000	25	GATA2	9606.ENSP00000345681	Endothelial transcription factor GATA-2; Transcriptional activator which regulates endothelin-1 gene expression in endothelial cells. Binds to the consensus sequence 5'- AGATAG-3'.
MCL	1	Red	#ff0000	25	GATAD2B	9606.ENSP00000357644	Transcriptional repressor p66-beta; Transcriptional repressor. Enhances MBD2-mediated repression. Efficient repression requires the presence of GATAD2A. Targets MBD3 to discrete loci in the nucleus. May play a role in synapse development.
MCL	1	Red	#ff0000	25	IKBKG	9606.ENSP00000483825	NF-kappa-B essential modulator; Regulatory subunit of the IKK core complex which phosphorylates inhibitors of NF-kappa-B thus leading to the dissociation of the inhibitor/NF-kappa-B complex and ultimately the degradation of the inhibitor. Its binding to scaffolding polyubiquitin seems to play a role in IKK activation by multiple signaling receptor pathways. However, the specific type of polyubiquitin recognized upon cell stimulation (either 'Lys-63'-linked or linear polyubiquitin) and its functional importance is reported conflictingly. Also considered to be a mediator for TAX activati [...] 
MCL	1	Red	#ff0000	25	KDM1A	9606.ENSP00000383042	Lysine-specific histone demethylase 1A; Histone demethylase that can demethylate both 'Lys-4' (H3K4me) and 'Lys-9' (H3K9me) of histone H3, thereby acting as a coactivator or a corepressor, depending on the context. Acts by oxidizing the substrate by FAD to generate the corresponding imine that is subsequently hydrolyzed. Acts as a corepressor by mediating demethylation of H3K4me, a specific tag for epigenetic transcriptional activation. Demethylates both mono- (H3K4me1) and di-methylated (H3K4me2) H3K4me. May play a role in the repression of neuronal genes. Alone, it is unable to demet [...] 
MCL	1	Red	#ff0000	25	KMT2D	9606.ENSP00000301067	Histone-lysine N-methyltransferase 2D; Histone methyltransferase. Methylates 'Lys-4' of histone H3 (H3K4me). H3K4me represents a specific tag for epigenetic transcriptional activation. Acts as a coactivator for estrogen receptor by being recruited by ESR1, thereby activating transcription. Belongs to the class V-like SAM-binding methyltransferase superfamily. Histone-lysine methyltransferase family. TRX/MLL subfamily.
MCL	1	Red	#ff0000	25	KRT5	9606.ENSP00000252242	Keratin, type II cytoskeletal 5; Keratin 5; Belongs to the intermediate filament family.
MCL	1	Red	#ff0000	25	LGR6	9606.ENSP00000356247	Leucine-rich repeat-containing G-protein coupled receptor 6; Receptor for R-spondins that potentiates the canonical Wnt signaling pathway and acts as a marker of multipotent stem cells in the epidermis. Upon binding to R-spondins (RSPO1, RSPO2, RSPO3 or RSPO4), associates with phosphorylated LRP6 and frizzled receptors that are activated by extracellular Wnt receptors, triggering the canonical Wnt signaling pathway to increase expression of target genes. In contrast to classical G-protein coupled receptors, does not activate heterotrimeric G-proteins to transduce the signal. May act as [...] 
MCL	1	Red	#ff0000	25	MAD2L2	9606.ENSP00000235310	Mitotic spindle assembly checkpoint protein MAD2B; Adapter protein able to interact with different proteins and involved in different biological processes. Mediates the interaction between the error-prone DNA polymerase zeta catalytic subunit REV3L and the inserter polymerase REV1, thereby mediating the second polymerase switching in translesion DNA synthesis. Translesion DNA synthesis releases the replication blockade of replicative polymerases, stalled in presence of DNA lesions. Component of the shieldin complex, which plays an important role in repair of DNA double-stranded breaks  [...] 
MCL	1	Red	#ff0000	25	NFKBIA	9606.ENSP00000216797	NF-kappa-B inhibitor alpha; Inhibits the activity of dimeric NF-kappa-B/REL complexes by trapping REL dimers in the cytoplasm through masking of their nuclear localization signals. On cellular stimulation by immune and proinflammatory responses, becomes phosphorylated promoting ubiquitination and degradation, enabling the dimeric RELA to translocate to the nucleus and activate transcription.
MCL	1	Red	#ff0000	25	OTULIN	9606.ENSP00000284274	Ubiquitin thioesterase otulin; Deubiquitinase that specifically removes linear ('Met-1'- linked) polyubiquitin chains to substrates and acts as a regulator of angiogenesis and innate immune response. Required during angiogenesis, craniofacial and neuronal development by regulating the canonical Wnt signaling together with the LUBAC complex. Acts as a negative regulator of NF-kappa-B by regulating the activity of the LUBAC complex. OTULIN function is mainly restricted to homeostasis of the LUBAC complex: acts by removing 'Met- 1'-linked autoubiquitination of the LUBAC complex, thereby p [...] 
MCL	1	Red	#ff0000	25	PRIMA1	9606.ENSP00000376848	Proline-rich membrane anchor 1; Required to anchor acetylcholinesterase (ACHE) to the basal lamina of the neuromuscular junction and to the membrane of neuronal synapses in brain. Also able to organize ACHE into tetramers (By similarity).
MCL	1	Red	#ff0000	25	RCC1	9606.ENSP00000497402	Regulator of chromosome condensation; Guanine-nucleotide releasing factor that promotes the exchange of Ran-bound GDP by GTP, and thereby plays an important role in RAN-mediated functions in nuclear import and mitosis. Contributes to the generation of high levels of chromosome-associated, GTP-bound RAN, which is important for mitotic spindle assembly and normal progress through mitosis. Via its role in maintaining high levels of GTP-bound RAN in the nucleus, contributes to the release of cargo proteins from importins after nuclear import. Involved in the regulation of onset of chromoso [...] 
MCL	1	Red	#ff0000	25	SLC2A1	9606.ENSP00000416293	Solute carrier family 2, facilitated glucose transporter member 1; Facilitative glucose transporter, which is responsible for constitutive or basal glucose uptake. Has a very broad substrate specificity; can transport a wide range of aldoses including both pentoses and hexoses. Most important energy carrier of the brain: present at the blood-brain barrier and assures the energy-independent, facilitative transport of glucose into the brain.
MCL	1	Red	#ff0000	25	TP53	9606.ENSP00000269305	Cellular tumor antigen p53; Acts as a tumor suppressor in many tumor types; induces growth arrest or apoptosis depending on the physiological circumstances and cell type. Involved in cell cycle regulation as a trans-activator that acts to negatively regulate cell division by controlling a set of genes required for this process. One of the activated genes is an inhibitor of cyclin-dependent kinases. Apoptosis induction seems to be mediated either by stimulation of BAX and FAS antigen expression, or by repression of Bcl-2 expression. Its pro-apoptotic activity is activated via its intera [...] 
MCL	1	Red	#ff0000	25	TRIM3	9606.ENSP00000433102	Tripartite motif-containing protein 3; Probably involved in vesicular trafficking via its association with the CART complex. The CART complex is necessary for efficient transferrin receptor recycling but not for EGFR degradation. Positively regulates motility of microtubule-dependent motor protein KIF21B (By similarity).
MCL	1	Red	#ff0000	25	TYMS	9606.ENSP00000315644	Thymidylate synthase; Contributes to the de novo mitochondrial thymidylate biosynthesis pathway.
MCL	1	Red	#ff0000	25	USP4	9606.ENSP00000265560	Ubiquitin carboxyl-terminal hydrolase 4; Deubiquitinating enzyme that removes conjugated ubiquitin from target proteins. Deubiquitinates PDPK1. Deubiquitinates TRIM21. Deubiquitinates receptor ADORA2A which increases the amount of functional receptor at the cell surface. May regulate mRNA splicing through deubiquitination of the U4 spliceosomal protein PRPF3. This may prevent its recognition by the U5 component PRPF8 thereby destabilizing interactions within the U4/U6.U5 snRNP. May also play a role in the regulation of quality control in the ER.
MCL	1	Red	#ff0000	25	WNT4	9606.ENSP00000290167	Protein Wnt-4; Ligand for members of the frizzled family of seven transmembrane receptors (Probable). Plays an important role in the embryonic development of the urogenital tract and the lung. Required for normal mesenchyme to epithelium transition during embryonic kidney development. Required for the formation of early epithelial renal vesicles during kidney development (By similarity). Required for normal formation of the Mullerian duct in females, and normal levels of oocytes in the ovaries. Required for normal down-regulation of 3 beta-hydroxysteroid dehydrogenase in the ovary. Req [...] 
MCL	1	Red	#ff0000	25	WRAP53	9606.ENSP00000324203	Telomerase Cajal body protein 1; RNA chaperone that plays a key role in telomere maintenance and RNA localization to Cajal bodies. Specifically recognizes and binds the Cajal body box (CAB box) present in both small Cajal body RNAs (scaRNAs) and telomerase RNA template component (TERC). Essential component of the telomerase holoenzyme complex, a ribonucleoprotein complex essential for the replication of chromosome termini that elongates telomeres in most eukaryotes. In the telomerase holoenzyme complex, required to stimulate the catalytic activity of the complex. Acts by specifically b [...] 
MCL	2	Salmon	#ff8c65	6	BDKRB1	9606.ENSP00000216629	B1 bradykinin receptor; This is a receptor for bradykinin. Could be a factor in chronic pain and inflammation.
MCL	2	Salmon	#ff8c65	6	GNAS	9606.ENSP00000360141	Guanine nucleotide-binding protein G(s) subunit alpha isoforms XLas; Guanine nucleotide-binding proteins (G proteins) function as transducers in numerous signaling pathways controlled by G protein- coupled receptors (GPCRs). Signaling involves the activation of adenylyl cyclases, resulting in increased levels of the signaling molecule cAMP. GNAS functions downstream of several GPCRs, including beta-adrenergic receptors. XLas isoforms interact with the same set of receptors as GNAS isoforms (By similarity).
MCL	2	Salmon	#ff8c65	6	GPER1	9606.ENSP00000380281	G-protein coupled estrogen receptor 1; G-protein coupled estrogen receptor that binds to 17-beta- estradiol (E2) with high affinity, leading to rapid and transient activation of numerous intracellular signaling pathways. Stimulates cAMP production, calcium mobilization and tyrosine kinase Src inducing the release of heparin-bound epidermal growth factor (HB-EGF) and subsequent transactivation of the epidermal growth factor receptor (EGFR), activating downstream signaling pathways such as PI3K/Akt and ERK/MAPK. Mediates pleiotropic functions among others in the cardiovascular, endocrine [...] 
MCL	2	Salmon	#ff8c65	6	NTSR2	9606.ENSP00000303686	Neurotensin receptor type 2; Receptor for the tridecapeptide neurotensin. It is associated with G proteins that activate a phosphatidylinositol-calcium second messenger system.
MCL	2	Salmon	#ff8c65	6	OPRD1	9606.ENSP00000234961	Delta-type opioid receptor; G-protein coupled receptor that functions as receptor for endogenous enkephalins and for a subset of other opioids. Ligand binding causes a conformation change that triggers signaling via guanine nucleotide-binding proteins (G proteins) and modulates the activity of down-stream effectors, such as adenylate cyclase. Signaling leads to the inhibition of adenylate cyclase activity. Inhibits neurotransmitter release by reducing calcium ion currents and increasing potassium ion conductance. Plays a role in the perception of pain and in opiate-mediated analgesia.  [...] 
MCL	2	Salmon	#ff8c65	6	SST	9606.ENSP00000287641	Somatostatin-14; [Somatostatin-14]: Inhibits the secretion of pituitary hormones, including that of growth hormone/somatotropin (GH1), PRL, ACTH, luteinizing hormone (LH) and TSH. Also impairs ghrelin- and GnRH- stimulated secretion of GH1 and LH; the inhibition of ghrelin- stimulated secretion of GH1 can be further increased by neuronostatin.
MCL	3	Brown	#b25a00	5	DAOA	9606.ENSP00000483757	D-amino acid oxidase activator; Seems to activate D-amino acid oxidase.
MCL	3	Brown	#b25a00	5	ERI3	9606.ENSP00000361331	ERI1 exoribonuclease family member 3.
MCL	3	Brown	#b25a00	5	SYN2	9606.ENSP00000480050	Synapsin-2; Neuronal phosphoprotein that coats synaptic vesicles, binds to the cytoskeleton, and is believed to function in the regulation of neurotransmitter release. May play a role in noradrenaline secretion by sympathetic neurons (By similarity); Belongs to the synapsin family.
MCL	3	Brown	#b25a00	5	SYT12	9606.ENSP00000377520	Synaptotagmin-12; Synaptic vesicle phosphoprotein that enhances spontaneous neurotransmitter release but does not effect induced neurotransmitter release (By similarity). Unlike other synaptotagmins, it does not bind Ca(2+) or phospholipids (By similarity). Essential for mossy-fiber long-term potentiation in the hippocampus (By similarity).
MCL	3	Brown	#b25a00	5	SYT5	9606.ENSP00000346265	Synaptotagmin-5; May be involved in Ca(2+)-dependent exocytosis of secretory vesicles through Ca(2+) and phospholipid binding to the C2 domain or may serve as Ca(2+) sensors in the process of vesicular trafficking and exocytosis. Regulates the Ca(2+)-dependent secretion of norepinephrine in PC12 cells. Required for export from the endocytic recycling compartment to the cell surface (By similarity).
MCL	4	Yellow	#ffd965	4	IGF2BP1	9606.ENSP00000290341	Insulin-like growth factor 2 mRNA-binding protein 1; RNA-binding factor that recruits target transcripts to cytoplasmic protein-RNA complexes (mRNPs). This transcript 'caging' into mRNPs allows mRNA transport and transient storage. It also modulates the rate and location at which target transcripts encounter the translational apparatus and shields them from endonuclease attacks or microRNA-mediated degradation. Plays a direct role in the transport and translation of transcripts required for axonal regeneration in adult sensory neurons (By similarity). Regulates localized beta- actin/AC [...] 
MCL	4	Yellow	#ffd965	4	PUM2	9606.ENSP00000338173	Pumilio homolog 2; Sequence-specific RNA-binding protein that acts as a post- transcriptional repressor by binding the 3'-UTR of mRNA targets. Binds to an RNA consensus sequence, the Pumilio Response Element (PRE), 5'- UGUANAUA-3', that is related to the Nanos Response Element (NRE) (,. Mediates post-transcriptional repression of transcripts via different mechanisms: acts via direct recruitment of the CCR4-POP2-NOT deadenylase leading to translational inhibition and mRNA degradation. Also mediates deadenylation- independent repression by promoting accessibility of miRNAs. Acts as a pos [...] 
MCL	4	Yellow	#ffd965	4	THRB	9606.ENSP00000379904	Thyroid hormone receptor beta; Nuclear hormone receptor that can act as a repressor or activator of transcription. High affinity receptor for thyroid hormones, including triiodothyronine and thyroxine.
MCL	4	Yellow	#ffd965	4	TRIP12	9606.ENSP00000373696	E3 ubiquitin-protein ligase TRIP12; E3 ubiquitin-protein ligase involved in ubiquitin fusion degradation (UFD) pathway and regulation of DNA repair. Part of the ubiquitin fusion degradation (UFD) pathway, a process that mediates ubiquitination of protein at their N-terminus, regardless of the presence of lysine residues in target proteins. Acts as a key regulator of DNA damage response by acting as a suppressor of RNF168, an E3 ubiquitin-protein ligase that promotes accumulation of 'Lys-63'-linked histone H2A and H2AX at DNA damage sites, thereby acting as a guard against excessive spr [...] 
MCL	5	Dark Golden Rod	#b0b200	3	CD8A	9606.ENSP00000386559	T-cell surface glycoprotein CD8 alpha chain; Integral membrane glycoprotein that plays an essential role in the immune response and serves multiple functions in responses against both external and internal offenses. In T-cells, functions primarily as a coreceptor for MHC class I molecule:peptide complex. The antigens presented by class I peptides are derived from cytosolic proteins while class II derived from extracellular proteins. Interacts simultaneously with the T-cell receptor (TCR) and the MHC class I proteins presented by antigen presenting cells (APCs). In turn, recruits the Sr [...] 
MCL	5	Dark Golden Rod	#b0b200	3	PVRIG	9606.ENSP00000316675	Transmembrane protein PVRIG; Cell surface receptor for NECTIN2. May act as a coinhibitory receptor that suppresses T-cell receptor-mediated signals. Following interaction with NECTIN2, inhibits T-cell proliferation. Competes with CD226 for NECTIN2-binding.
MCL	5	Dark Golden Rod	#b0b200	3	UNC13D	9606.ENSP00000207549	Protein unc-13 homolog D; Plays a role in cytotoxic granule exocytosis in lymphocytes. Required for both granule maturation and granule docking and priming at the immunologic synapse. Regulates assembly of recycling and late endosomal structures, leading to the formation of an endosomal exocytic compartment that fuses with perforin-containing granules at the immunologic synapse and licences them for exocytosis. Regulates Ca(2+)- dependent secretory lysosome exocytosis in mast cells.
MCL	6	Khaki	#d6ff65	3	BICRAL	9606.ENSP00000313933	BRD4-interacting chromatin-remodeling complex-associated protein-like; Component of SWI/SNF chromatin remodeling subcomplex GBAF that carries out key enzymatic activities, changing chromatin structure by altering DNA-histone contacts within a nucleosome in an ATP- dependent manner.
MCL	6	Khaki	#d6ff65	3	BRD7	9606.ENSP00000378181	Bromodomain-containing protein 7; Acts both as coactivator and as corepressor. May play a role in chromatin remodeling. Activator of the Wnt signaling pathway in a DVL1-dependent manner by negatively regulating the GSK3B phosphotransferase activity. Induces dephosphorylation of GSK3B at 'Tyr-216'. Down-regulates TRIM24-mediated activation of transcriptional activation by AR (By similarity). Transcriptional corepressor that down-regulates the expression of target genes. Binds to target promoters, leading to increased histone H3 acetylation at 'Lys-9' (H3K9ac). Binds to the ESR1 promoter [...] 
MCL	6	Khaki	#d6ff65	3	SMARCD3	9606.ENSP00000262188	SWI/SNF-related matrix-associated actin-dependent regulator of chromatin subfamily D member 3; Involved in transcriptional activation and repression of select genes by chromatin remodeling (alteration of DNA-nucleosome topology). Component of SWI/SNF chromatin remodeling complexes that carry out key enzymatic activities, changing chromatin structure by altering DNA-histone contacts within a nucleosome in an ATP-dependent manner. Stimulates nuclear receptor mediated transcription. Belongs to the neural progenitors-specific chromatin remodeling complex (npBAF complex) and the neuron-spec [...] 
MCL	7	Olive Drab	#56b200	3	BPTF	9606.ENSP00000307208	Nucleosome-remodeling factor subunit BPTF; Histone-binding component of NURF (nucleosome-remodeling factor), a complex which catalyzes ATP-dependent nucleosome sliding and facilitates transcription of chromatin. Specifically recognizes H3 tails trimethylated on 'Lys-4' (H3K4me3), which mark transcription start sites of virtually all active genes. May also regulate transcription through direct binding to DNA or transcription factors.
MCL	7	Olive Drab	#56b200	3	ZMAT2	9606.ENSP00000274712	Zinc finger matrin-type protein 2; Involved in pre-mRNA splicing as a component of the spliceosome.
MCL	7	Olive Drab	#56b200	3	ZNF207	9606.ENSP00000378165	BUB3-interacting and GLEBS motif-containing protein ZNF207; Kinetochore- and microtubule-binding protein that plays a key role in spindle assembly. ZNF207/BuGZ is mainly composed of disordered low- complexity regions and undergoes phase transition or coacervation to form temperature-dependent liquid droplets. Coacervation promotes microtubule bundling and concentrates tubulin, promoting microtubule polymerization and assembly of spindle and spindle matrix by concentrating its building blocks. Also acts as a regulator of mitotic chromosome alignment by mediating the stability and kineto [...] 
MCL	8	Light Green 2	#89ff65	3	LIN7C	9606.ENSP00000278193	Protein lin-7 homolog C; Plays a role in establishing and maintaining the asymmetric distribution of channels and receptors at the plasma membrane of polarized cells. Forms membrane-associated multiprotein complexes that may regulate delivery and recycling of proteins to the correct membrane domains. The tripartite complex composed of LIN7 (LIN7A, LIN7B or LIN7C), CASK and APBA1 may have the potential to couple synaptic vesicle exocytosis to cell adhesion in brain. Ensures the proper localization of GRIN2B (subunit 2B of the NMDA receptor) to neuronal postsynaptic density and may funct [...] 
MCL	8	Light Green 2	#89ff65	3	MAGI3	9606.ENSP00000304604	Membrane-associated guanylate kinase, WW and PDZ domain-containing protein 3; Acts as a scaffolding protein at cell-cell junctions, thereby regulating various cellular and signaling processes. Cooperates with PTEN to modulate the kinase activity of AKT1. Its interaction with PTPRB and tyrosine phosphorylated proteins suggests that it may link receptor tyrosine phosphatase with its substrates at the plasma membrane. In polarized epithelial cells, involved in efficient trafficking of TGFA to the cell surface. Regulates the ability of LPAR2 to activate ERK and RhoA pathways. Regulates the [...] 
MCL	8	Light Green 2	#89ff65	3	MPP1	9606.ENSP00000358547	55 kDa erythrocyte membrane protein; Essential regulator of neutrophil polarity. Regulates neutrophil polarization by regulating AKT1 phosphorylation through a mechanism that is independent of PIK3CG activity (By similarity).
MCL	9	Green	#00b203	3	POMP	9606.ENSP00000370222	Proteasome maturation protein; Molecular chaperone essential for the assembly of standard proteasomes and immunoproteasomes. Degraded after completion of proteasome maturation. Mediates the association of 20S preproteasome with the endoplasmic reticulum; Belongs to the POMP/UMP1 family.
MCL	9	Green	#00b203	3	PSMC3	9606.ENSP00000481029	26S proteasome regulatory subunit 6A; Component of the 26S proteasome, a multiprotein complex involved in the ATP-dependent degradation of ubiquitinated proteins. This complex plays a key role in the maintenance of protein homeostasis by removing misfolded or damaged proteins, which could impair cellular functions, and by removing proteins whose functions are no longer required. Therefore, the proteasome participates in numerous cellular processes, including cell cycle progression, apoptosis, or DNA damage repair. PSMC3 belongs to the heterohexameric ring of AAA (ATPases associated wit [...] 
MCL	9	Green	#00b203	3	TXNL1	9606.ENSP00000217515	Thioredoxin-like protein 1; Active thioredoxin with a redox potential of about -250 mV.
